label,sublabel,description,styles,bgcolor
燃やさないごみ,,飲料用瓶以外のガラス・陶磁器・資源物以外の金属・缶類を専用コンテナ容器に。,img/moyasanai02.svg,#733b96
資源物(紙製品),,新聞・雑誌・ダンボール・紙パック・その他の紙製容器包装・雑古紙を紐で十文字縛り、小さいものは透明または半透明袋で。,img/shigen02.svg,#77ae1f
資源物(衣服),,衣服・布を透明または半透明袋で。※雨天または雨天が予想される日は出さない,img/shigen02.svg,#77ae1f
資源物(ペットボトル),,飲料用・醤油用を専用コンテナに。※汚れているものは「燃やすごみ」へ,img/shigen02.svg,#77ae1f
資源物(缶・瓶),,飲料用瓶・飲料用缶・スプレー缶・乾電池等を専用コンテナに。,img/shigen02.svg,#77ae1f
燃やすごみ,,資源物以外の紙・プラ・布/生ごみ類/皮・ゴム・ビニール類を鹿沼市指定袋で。,img/moyasu02.svg,#ea3b13
あきびん,,「月1回のあきびんの日」に出せるものです。色ごとに分けて出してください。ビールびんや一升びんは、酒屋さんへ。,img/bin02.svg,#2dc7aa
